{
  "$schema": "https://jscene3d.org/schemas/import-1.json",
  "schemaVersion": 1,
  "id": "freedoom-map01-actors",
  "source": "asset:freedoom",
  "importer": "io.github.glynch.doomed-corridors/actors",
  "selection": ["maps/MAP01"],
  "settings": {
    "actor-catalog": "actors",
    "combat-rules": "combat",
    "combat-presentation": "combat-presentation"
  }
}
